{
  "schemaVersion": 1,
  "journey": "settings-edits",
  "generated": true,
  "actions": [
    { "type": "navigate", "target": "settings" },
    { "type": "set-preference", "target": "font-scale", "value": "large" },
    { "type": "set-preference", "target": "artwork-mode", "value": "compact" },
    { "type": "set-preference", "target": "metadata-visibility", "value": "full" },
    { "type": "set-preference", "target": "color-scheme", "value": "ink" }
  ],
  "expected": {
    "identity": "Artbook",
    "route": "settings",
    "status": "preference-changed",
    "assertion": "Settings edits replace typed preference values and remain serializable."
  }
}
